{
  "schema": "advisory-report.v1",
  "source": "advisory-fixture（源自 Octop 参谋团 9BZAQT/B线补料率-停线决策收敛报告.md；评分卡六维由 Lead 按证据质量人工打分，非 AI 自评）",
  "generated_at": "2026-10-26T15:38:00+08:00",
  "crew_id": "manufacturing-advisory-board",
  "goal": "B 产线补料率 5.1%→7.2% 连续 7 天：是否停线 4–6h 查根因",
  "finding": [
    {
      "factor": "设备/模具渐进性劣化（排气渐堵、水路结垢、加热圈老化）",
      "confidence": "0.55",
      "evidence": [
        "形态判据：+0.3pp/天、单调、无跳变、无阶跃 → 排掉来料批次（跳变+平台）与口径变更（阶跃）两类形态（s2 ops-advice）",
        "7 点严格单调对随机波动几乎致命（1/7!≈0.02%），但对系统性因素不区分 → 只能证明「有系统性因素在动」（s1 ai-reliability-review）",
        "停线对线性斜坡的信息增量接近 0：停线 1 小时模具仍是脏的，对应验证动作是保养与换模而不是停线"
      ]
    },
    {
      "factor": "统计口径变更（分母塌缩 / 补料单生成逻辑变更）",
      "confidence": "0.40",
      "evidence": [
        "应投量降 29%（减产/换小批量/品种切换）即可让 5.1% 变 7.2%，补料行为本身没变（s1 失败模式①）",
        "MES 版本更新或新增自动补料单会让曲线单调爬升而物理补投次数不变（s1 失败模式②）；曲线无阶跃，故口径变更嫌疑低于渐进劣化"
      ]
    }
  ],
  "cannot_attribute": [
    "分母塌缩：应投量下降 29% 即可单独解释全部升幅，现有汇总数无法排除",
    "定义切换：补料单生成规则在 MES 侧是否变更未取证",
    "辛普森悖论：高补料率品种占比 10%→35% 时加权上升而各品种自身持平，汇总层无法分辨",
    "单位/换算系数断裂：uom_conv_factor 为 NULL 默认 1.0 的物料逐日增多，制造虚假单调增量",
    "右删失：T-0/T-1 录入完成度 60–80%，T+3 批量确认会形成阶梯式单调伪影",
    "判定阈值漂移：IPQC 加严会让不良比例上升，并制造「停线有效」的假因果",
    "7 点外推与自相关：有效独立样本仅 2–3，误差棒比效应更宽，外推数字不进决策主表",
    "物料批次 RM-2026043 同日首现：既有证据无法区分「同批料异常」与「新料导入导致换算系数异常」"
  ],
  "scorecard": {
    "data_completeness": 2,
    "timeliness": 4,
    "significance": 4,
    "exclusivity": 1,
    "history": 3,
    "human_ai_consistency": 0
  },
  "recommendation": [
    {
      "action": "B0 查口径 + 四维分层（机台/班次/模具/批次），固定篮子重算补料率日斜率",
      "roi": {
        "cost": "0（2 人×0.5 天）",
        "avoided": "若属口径问题，2.1X 元/天立即归零",
        "anchor": "pack.roi_anchors（无直接锚点：内部分摊人工）"
      },
      "irreversibility": "reversible"
    },
    {
      "action": "B1 预防保养：清排气、通水路、查加热圈（停机 0–0.5h）",
      "roi": {
        "cost": "500（锚点 maintenance）",
        "avoided": "若为结垢/排气堵塞则 2.1X 元/天永久消除",
        "anchor": "pack.roi_anchors.maintenance"
      },
      "irreversibility": "reversible"
    },
    {
      "action": "B2 换模验证：备用模上机看补料率是否回落 5.1%（含 0.5–1h 停机）",
      "roi": {
        "cost": "800（锚点 mold_change，另计 600–1200 停机）",
        "avoided": "¥800 买一个 yes/no：回落即锁死模具根因，不回落即干净排除",
        "anchor": "pack.roi_anchors.mold_change"
      },
      "irreversibility": "irreversible"
    }
  ],
  "security_gate": {
    "status": "pending_user_confirmation",
    "requested_by": "manufacturing-advisory-board",
    "requested_at": "2026-10-26",
    "reason": "换模属不可逆动作（需停机 0.5–1h 并动用备用模），须老板确认后才能进入行动单"
  },
  "attribution_method": "MANUAL",
  "sources": [
    "../../.octop/agents/9BZAQT/generated/B线补料率-停线决策收敛报告.md"
  ],
  "decision_log_entry": {
    "context": "B 线 2026-10-20~10-26 补料率 5.1%→7.2% 连续 7 天单调上行（+0.3pp/天），无跳变无阶跃；参谋团本轮降级为置信度 C（空值率未提供、候选归因≥2、仅有 B 线汇总数）",
    "advice": "方向校验：目标「降回 5.1%」合理，动作「停线 4–6h 查根因」反向抑制（¥4800–7200 确定支出，对线性斜坡信息增量≈0）→ 打回重归因。排序 B0 查口径(¥0) → B1 保养(¥500)/B2 换模(¥800) → A 停线(¥4800–7200) → C 维持现状(不推荐)；B 转 A 三条须同时满足：B0 已排除口径、B1+B2 后仍>6.5%、连续 N≥3 天仍>7.0% 且在上行",
    "expected_result": "固定篮子重算后日斜率 <0.10pp/天（原始 0.30）则统计口径解释为主；保养/换模后 7 天内回落至 ≤5.4%（包阈值）则锁定渐进劣化；两者皆不成立则升级为停线排查",
    "verification_plan": "① B0：产线质量工程师 1 人 2–4h 固定篮子重算 + 三项卫生量（应投总量 7 天变化率、uom_conv_factor 异常占比、defect_code 缺失率）② B1：保养单 + 保养后 7 天补料率 ③ B2：备用模上机 72h 补料率对比 ④ T+7 回看由 review_due 触发"
  }
}
